{
  "$id": "urn:ratatoskr:contracts:events:v1:KnowledgeDeletionAcknowledged",
  "$schema": "https://json-schema.org/draft/2020-12/schema",
  "title": "KnowledgeDeletionAcknowledged",
  "description": "Payload of `knowledge.deletion.acknowledged.v1`: Knowledge tells a producer that one of its\ndeletion facts was applied or refused.\n\nThe enclosing event envelope is produced by `ratatoskr-knowledge`. Its `event_id` is the\noutbox id, `aggregate_id` equals `subject`, `correlation_id` is copied from\nthe acknowledged envelope, `causation_id` is `event:<acknowledged_event_id>` and `tenant_id`\nequals `owner`.\n\nThe acknowledgement names no content: only ids, the owner and a subject reference. A\nproducer matches it to the outbox row whose `event_id` equals\n`acknowledged_event_id` and whose tenant equals\n`owner`, and ignores one that matches no row. A duplicate acknowledgement\nchanges nothing.\n\n`validate()` runs on every deserialization, so a payload that violates the\noutcome rule never reaches a consumer.",
  "type": "object",
  "properties": {
    "acknowledged_at": {
      "description": "Instant Knowledge decided the outcome, according to the Knowledge clock.",
      "$ref": "#/$defs/WireTimestamp"
    },
    "acknowledged_event_id": {
      "description": "The `event_id` of the deletion fact this acknowledgement answers.",
      "$ref": "#/$defs/EventId"
    },
    "family": {
      "description": "Which deletion fact family was answered.",
      "$ref": "#/$defs/DeletionAckFamily"
    },
    "outcome": {
      "description": "Whether the deletion was applied or refused.",
      "$ref": "#/$defs/DeletionAckOutcome"
    },
    "owner": {
      "description": "The owner of the deleted data.",
      "$ref": "#/$defs/TenantRef"
    },
    "refusal": {
      "description": "Why the deletion was refused. Present exactly when `outcome` is `refused`.",
      "anyOf": [
        {
          "$ref": "#/$defs/DeletionAckRefusal"
        },
        {
          "type": "null"
        }
      ]
    },
    "subject": {
      "description": "The subject the deletion fact named, as an opaque reference.",
      "$ref": "#/$defs/EntityRef"
    }
  },
  "additionalProperties": true,
  "required": [
    "acknowledged_at",
    "acknowledged_event_id",
    "family",
    "outcome",
    "owner",
    "subject"
  ],
  "x-ratatoskr-provenance": {
    "canonical_source": "ratatoskr_operation_contracts::KnowledgeDeletionAcknowledged",
    "contract_id": "knowledge.deletion_acknowledged",
    "contract_major_version": 1,
    "generated": "DO NOT EDIT — generated by contractsc from the canonical Rust source. Change the Rust type and run `cargo contracts generate`.",
    "generator": "contractsc",
    "generator_version": "0.1.0",
    "schemars_version": "1.2.2",
    "source_digest": "sha256:361ba06e8f76339084fb3c6cca32fb93ffab7ad353b7c64fa52da09acc1bc150",
    "validation_note": "This schema is a LOWER BOUND on validity. Cross-field invariants and canonical-form rules are enforced by the canonical Rust type; see fixtures/invalid-expectations.toml for which layer rejects what."
  },
  "x-ratatoskr-unknown-policy": "preserve",
  "$defs": {
    "DeletionAckFamily": {
      "description": "Which deletion fact an acknowledgement answers.",
      "oneOf": [
        {
          "description": "An `ai_archive.subject.tombstoned.v1` fact from `ratatoskr-chatgpt` or `ratatoskr-claude`.",
          "type": "string",
          "const": "ai_archive"
        },
        {
          "description": "A `social.source.removed.v1` fact from X, Instagram or Threads.",
          "type": "string",
          "const": "social"
        }
      ]
    },
    "DeletionAckOutcome": {
      "description": "What Knowledge did with the deletion fact.",
      "oneOf": [
        {
          "description": "The rows were deleted and the stored blobs were collected, or the fact repeated one that\nhad been applied.",
          "type": "string",
          "const": "applied"
        },
        {
          "description": "Knowledge did not delete anything. `KnowledgeDeletionAcknowledged::refusal` says why.",
          "type": "string",
          "const": "refused"
        }
      ]
    },
    "DeletionAckRefusal": {
      "description": "Why Knowledge refused to apply a deletion fact.",
      "oneOf": [
        {
          "description": "The subject belongs to another owner than the one the fact names. The data stays in\nKnowledge and an operator must look.",
          "type": "string",
          "const": "foreign_subject"
        }
      ]
    },
    "EntityRef": {
      "title": "EntityRef",
      "description": "A namespaced, polymorphic wire reference, serialized as `<kind>:<local_id>`. The kind vocabulary is open: an unrecognised kind is preserved verbatim. The local identity is opaque and need not be a UUID; when it is one it must be the canonical lowercase hyphenated spelling, so one identity has one reference. Equality is octet equality of `<kind>:<local_id>`: the kind is lowercase by grammar, and the local part is case-sensitive and never case-folded, because provider identities are case-significant. This rule is narrower than the `pattern` below, which cannot express it.",
      "type": "string",
      "examples": [
        "document:018f0000-0000-7000-8000-000000000002",
        "x-post:123"
      ],
      "maxLength": 289,
      "pattern": "^[a-z][a-z0-9_-]{0,31}:[A-Za-z0-9][A-Za-z0-9._~:@+-]{0,255}$"
    },
    "EventId": {
      "title": "EventId",
      "description": "Identity of one event occurrence, and the at-least-once deduplication key. Bare canonical lowercase hyphenated UUID; not namespaced.",
      "type": "string",
      "format": "uuid",
      "examples": [
        "018f0000-0000-7000-8000-000000000001"
      ],
      "pattern": "^[0-9a-f]{8}-[0-9a-f]{4}-[0-9a-f]{4}-[0-9a-f]{4}-[0-9a-f]{12}$"
    },
    "TenantRef": {
      "title": "TenantRef",
      "description": "The owner of the data a record concerns, wire form `user:<uuid>`. The kind set is closed: a consumer that cannot understand the owner kind must reject the record rather than process it.",
      "type": "string",
      "examples": [
        "user:018f0000-0000-7000-8000-000000000005"
      ],
      "maxLength": 41,
      "pattern": "^user:[0-9a-f]{8}-[0-9a-f]{4}-[0-9a-f]{4}-[0-9a-f]{4}-[0-9a-f]{12}$"
    },
    "WireTimestamp": {
      "title": "WireTimestamp",
      "description": "An instant on the wire: RFC 3339 in UTC with the literal `Z` designator. Exactly one spelling is accepted per instant — an input that does not re-render to itself is rejected. The field holding it declares the clock authority.",
      "type": "string",
      "format": "date-time",
      "examples": [
        "2026-08-17T10:00:00Z"
      ],
      "pattern": "^\\d{4}-\\d{2}-\\d{2}T\\d{2}:\\d{2}:\\d{2}(\\.\\d{1,9})?Z$"
    }
  }
}
